id,transcript,emotion
002494,ê,neutral
004269,dậy đi,neutral
002480,coi chừng bể đó,neutral
001463,cô tự đi mà giải quyết chuyện của cô đi,angry
008249,đầu óc chậm chạp của cô,angry
002135,mọi khi tỉnh ngủ lắm mà,surprise
001784,anh trả cho em hai mươi ngàn được không,neutral
008136,chị có biết á,angry
005095,rồi vô đi,neutral
003377,"cháo , để làm gì chứ , anh đã nói với em là đánh thức anh dậy sau một tiếng đồng hồ mà , bây giờ là hơn bảy giờ tối rồi , làm sao mà đi cắm trại được nữa",angry
006125,dạ ủa mà gì,surprise
002359,bộ cô là ăn mày hả,angry
006560,không có cấm,neutral
002061,em,neutral
001020,rồi tiếng nhạc thì,neutral
006533,bởi vậy,neutral
005888,tự nhiên hôm nay ế,sad
004934,đâm ra là bây giờ chân mới đau nè,sad
002429,em có cô vợ rất đảm đang,neutral
006285,"anh nhớ giặt giẻ lau nhà đó , lau nãy giờ mà chưa có giặt giẻ",neutral
002295,còn nhổ quái đảng,happy
003287,ý con là,neutral
000264,tôi sẽ nhờ yến chở về ngã,neutral
008239,chỉ có mình là đúng,neutral
003207,"có thể là , cô ấy mới về á",neutral
002220,trúc tính nhẩm nhanh thiệt đó nha,happy
005631,tôi đâu có biết đi xe đạp đâu,sad
002415,"anh thấy sau này anh với em cần phải chạy bộ nữa , ít nhất là một tuần một lần , như vậy thì con gà cục ta cục tác",neutral
005302,em xin lỗi,sad
003110,chú bảy hôm nay có bán tiết canh không vậy,neutral
003808,nhưng từ đây trở về sau,neutral
000391,nhớ đừng có làm nha,neutral
001322,tha lỗi cho em đó,happy
001047,thật tức cười quá đi,angry
008228,đây chỉ mới là một phần ba số quần áo mà tôi có thôi đó,neutral
001379,các cảnh hôn là khó nhất,neutral
000072,nè,angry
005854,thế Trúc trả lời sao,neutral
006801,mấy trăm phim,neutral
004949,nó mất rồi,neutral
005837,ừ,happy
006534,sẽ đem về trả Trúc đầy đủ,neutral
001526,trúc,neutral
001586,biết rồi,angry
002192,mà nè,neutral
000435,đưa đây,neutral
004795,ai mà xấu hổ chứ,neutral
007811,mi tu,neutral
006562,em tên gì,neutral
007796,cô đúng là một đứa con gái quái đảng biết chưa,neutral
003821,có phải anh ta gặp cô để nói rằng,neutral
002972,chứ sao nữa,neutral
000023,tôi đưa thì cứ cầm đi,angry
005469,cái chuyện tôi ở nhà của Trúc liên quan gì tới anh mà anh phải bực mình,angry
005768,cũng không muốn nói chuyện với tôi,sad
002975,đừng có giỡn nữa,angry
000598,chứ không phải vì hai trăm năm mươi triệu,neutral
003158,"có lẽ anh yêu vẻ đẹp cơ thể của người phụ nữ , nó luôn tạo cảm hứng cho anh khi bấm máy",neutral
008019,hôm nay anh sẽ làm một món thật đặc biệt để đãi em,happy
001563,em đang ở đâu vậy,neutral
006259,"tôi nói là cô rất phiền phức , tôi không thích cô mà , vậy tại sao cô cứ luẩn quẩn bên cạnh , và làm phiền tôi hoài vậy hả",angry
006669,đi đầu tới giờ này vẫn chưa về,neutral
004258,nhất là cô cuối cùng,neutral
003072,mười ngàn thôi,neutral
001278,mà sao sự nghiệp chụp hình khỏa thân của mình lận đận vậy trời,neutral
004798,con nói thật mà,angry
001100,sáng mà tôi đang ngủ ngon giấc,neutral
001808,may quá,neutral
007483,mà tìm được ba mẹ,neutral
006027,sao không vô công viên cho gần,neutral
007386,điện thoại bàn ai vậy ta,neutral
004998,năm tui bảy tuổi thấy mấy đứa bạn có xe đạp chạy tôi thích quá nên bắt mẹ mua cho một chiếc,neutral
001665,nhưng mà mở máy hoài nó không lên,neutral
001621,cầm lấy,neutral
002891,chuyện thế nào,neutral
006654,phải để yên tôi mới tìm cách giải quyết được chứ,neutral
000619,em nói quá,angry
003550,tôi xỉn đó,neutral
004062,may quá cô còn nhớ,neutral
004111,nói sao,neutral
006286,không phải sao hát múa tưng bừng vậy,neutral
006902,họ nói sẽ chờ em cho tới khi em tốt nghiệp vào tháng 6 mà,neutral
000924,nghĩ sao đòi đi với mình tới bữa tiệc,angry
003483,cũng may mà trúc lăn ra ngủ,neutral
000529,trong khi ngày xưa ba mẹ gọi về ăn cơm tôi cảm thấy bức bối khó chịu lắm,neutral
001426,tên trộm hôn tôi,angry
005483,cô vẫn còn đang ngủ hả,angry
001887,vậy nha thầy,neutral
004805,cám ơn nha,neutral
004609,"thôi được rồi , vậy thì bỏ hết đi",angry
001828,bà sáu,neutral
005207,thì cũng cuối tháng người ta mới trả lương,neutral
008306,thuốc của ba tôi tốt lắm,neutral
007137,thôi vậy thôi,neutral
001679,"cái gì , có hẹn hả",neutral
002928,không,neutral
006778,em đã đọc một số đoạn rồi,neutral
004920,như vậy khi diễn tâm lý em sẽ thoải mái không bị ức chế,neutral
000041,xin chào quý khách,happy
002177,chúc cô may mắn nha,neutral
002018,"có phải lúc đó thì cô sẽ chịu trách nhiệm cho việc này không , hả",neutral
006020,là ra khỏi nhà tới gặp cô ấy ở quán,neutral
006321,rõ ràng là tôi vừa nghe Trúc đó là may mà,neutral
004672,chuyện này chỉ có tôi với trúc biết thôi,neutral
002978,"mà con người không thể sống , khi không có cái nồi cơm , suy ra",neutral
000645,tôi mệt rồi và tôi muốn đi nghỉ,angry
003647,trời ơi,surprise
004245,chuyện gì nữa,neutral
007177,chứ con có làm gì cô ấy đâu,neutral
006404,mà dọn sạch bóng láng đó,neutral
007581,vậy là sao,angry
000597,chỉ như thế là đủ,neutral
001667,nếu cô không thích ngủ ngoài này,neutral
000644,mà nếu đài truyền hình biết á thế nào họ cũng đưa cô vô mục chuyện lạ việt nam á,neutral
007069,Trúc đừng có rối lên như vậy,neutral
003191,rồi sẽ dẫn tới tử vong đó,neutral
006696,mà lâu rồi không uống bia mình đang buồn,sad
005396,"một cái quần jean tôi bán cũng được hơn một triệu , chị có biết hông",angry
003234,ngủ giường kia á hả,neutral
000222,nên làm bể hoài,neutral
002510,thì cô phải cho tôi biết là cô chở tôi đi đâu chứ,angry
002444,và tất cả chỉ là một vở kịch cho ba mẹ mình viết ra để lừa mình thôi,angry
002385,vậy tôi về trước,neutral
007896,không được,neutral
007814,sao trúc đưa tui áo này trúc đưa tui cái áo thun bình thường là được rồi,neutral
000231,cô nói tôi là nhân viên của cô hả,neutral
002448,ờ thì khoảng nửa tiếng anh có mặt ở khách sạn em ở nha,neutral
005504,anh vừa nói chuyện với mẹ xong,neutral
005520,cô ấy vô duyên còn cô vô cùng duyên dáng được chưa,happy
008142,nè,angry
004293,tôi cũng không biết hiện giờ anh ta ở đâu đâu,sad
004367,nói vậy cũng nói được sao,angry
001160,cô ghét tôi,neutral
003963,mà bên kia,neutral
003945,cái gì vậy,neutral
005625,hiểu bài,neutral
001079,ừ,happy
004484,mà nhục nhất là tối hôm qua nhậu xỉn rồi tới nhà nó quậy nữa chứ,neutral
003199,tôi để lại hết trong bệnh viện rồi,sad
002747,bà sáu,angry
003434,anh hiều bán chong chóng sống ở đâu mà chẳng được,neutral
005671,cô trơ tráo thật á,angry
005598,thôi anh ra thay đồ trước nha,happy
000444,tôi nói gì hả,neutral
006688,cô bừa bãi,neutral
005211,sao cô lì quá vậy,angry
001629,tôi không làm được,angry
007894,một trăm ngàn được không,neutral
006005,sao món nào cô cũng ăn được vậy hả,surprise
005217,anh nghe đây,neutral
001574,dạ cũng đỡ rồi ạ,neutral
001568,làm sao mà tôi dám đi bán sách với lại đi xin việc chứ,neutral
004529,cuộc sống của tôi đang bế tắc,sad
000036,nên cô lo mà chuẩn bị đi nha,neutral
006085,tôi sẽ chỉ Trúc học thuộc lòng hai bốn chữ cái trước,neutral
003491,mà nói là không tính toán gì,neutral
006656,tại sao muốn hợp tác với em,neutral
004554,"cô nói với anh ta chuyện gì , tại sao lại không thể nói với tôi",angry
003527,ủa mà lạ thiệt nha,surprise
005575,chắc chắn là lầm mà,neutral
000469,xe của trúc có tám mươi ngàn hả,neutral
001641,không,neutral
003608,anh tới tìm em,neutral
007663,hai người đó đi xem phim chung với nhau hả,angry
008211,để chứng minh cho ba mẹ anh thấy tất cả những gì tốt đẹp nhất mà em nhận xét về anh,neutral
000268,cô khùng quá,neutral
002103,bao nhiêu đủ rồi,neutral
004497,chứ sáng nay tôi mà không chạy kịp á là ông chém tôi chết rồi à,neutral
006877,mà cô làm tốt vậy sao không rửa luôn đi,neutral
001213,"mà hợp đồng cũ còn thiếu , để bổ sung vào",neutral
000941,cứ bình tĩnh mà chạy nha,angry
002784,chỉ tại anh hơi bực mình chuyện công việc thôi chứ áo đẹp lắm,neutral
004592,xin lỗi cô,sad
001073,"minh minh , minh minh",angry
007019,lên ba mẹ tôi mới biết tôi trốn nhà đi,neutral
002309,"chúng tôi rất hợp nhau , à giống như là , chúng tôi sinh ra là để dành cho nhau vậy",happy
004945,trời ơi bán bộ này hả,surprise
004557,đâu có liên quan gì đến cô đâu,angry
006622,vậy cô đồng ý hả,happy
000120,ba,neutral
006379,căn nhà này,neutral
004963,tôi cho ai cái gì tôi không muốn đòi lại đâu,neutral
001859,em thừa biết là anh không thích ăn món đó mà,angry
007967,bây giờ chỉ cần hỏi thăm hàng xóm thôi là trắng đen rõ ràng,neutral
001121,"sao , mấy người khùng hả , cúp máy đi",angry
005879,đang cấp cứu trong bệnh viện á,neutral
005969,anh tới đưa cổ đi ăn rồi sau đó đưa về nhà luôn giùm tôi,neutral
000342,tôi rất tôn trọng sự riêng tư,neutral
006681,tôi hăm hai,angry
001591,lên xe đi nhiều chuyện quá,neutral
000720,mà trúc mặc áo dài đẹp lắm,neutral
005995,Trúc ơi,neutral
008286,em không nghĩ ra,neutral
001170,lợi đâu không thấy,happy
002361,cho nên đừng bao giờ có hỏi tôi những câu như vậy nữa,angry
006790,đối với cô ấy,neutral
005845,thấy chưa đúng rồi tôi đâu có làm gì cô ấy đâu,angry
003215,năm ấy cũng là năm thật buồn đối với gia đình tôi,sad
005507,ờ,neutral
005928,em lo quá à,neutral
006603,một giấc mơ khủng khiếp,neutral
003311,tui đi đâu thì kệ tui chứ,angry
001354,tôi đã chán ghét tất cả những scandal,neutral
000920,tôi đâu có nhớ là tôi chờ cô làm cái gì đâu,sad
002002,tại sao đột ngột như vậy,angry
000088,"tất cả những gì tôi đã hứa , đã nói với cô , cũng chỉ là những lời hứa , lời nói suông mà thôi",neutral
000612,con chào ba mẹ,neutral
007380,cái câu chuyện cô kể với mẹ tôi là có thật á hả,angry
003514,tôi là người mà,neutral
005774,chạy đi không sao đâu,neutral
004808,ghen cái gì,angry
006393,liên quan gì đến cô đâu,neutral
000181,"sao ngu quá vậy , tại sao lại nói chuyện đó",angry
002822,thôi cô đi lên phòng nha,neutral
006992,"nè , chuyện đó không được",angry
002115,mà nguyên đống đồ đẹp như vậy bán giá có ba triệu bảy thì tức thiệt,sad
005464,công nhận hai đứa mình nhìn đẹp đôi dễ sợ thấy không,happy
000958,chơi tiếp đi thầy,neutral
006737,"ủa , sao nhiều quá vậy , bao nhiêu trang",surprise
005288,ừ,happy
000407,thì con làm gì được,neutral
006451,tôi sẽ giết cô thật đó,angry
000328,cô dám gọi điện cho tôi nữa hả,angry
002940,sạch quá phải không,neutral
001348,và tôi nghĩ ngô đồng rất thích hợp để làm việc đó,neutral
002446,bởi thật ra giờ tôi đâu biết tôi hỏi gì đâu,neutral
006214,cho chúng tôi ở lại đây vài phút nữa đi mà,neutral
000775,cô điên thật rồi,angry
001537,"không cần đâu , vô giường đi ngủ đi",neutral
002495,dạ,happy
004981,sao căng thẳng quá hả,happy
004340,tôi ở phòng sáu mươi hai mới dọn về ở được năm ngày,neutral
000286,hả,angry
004064,cô á,neutral
004754,thấy lần trước mấy con gián cũng đâu có tự chui vô mùng tôi đâu,angry
006034,cô có biết là bây giờ tôi đang sống cảnh lang thang không nhà không cửa không cha không mẹ không hả,angry
001031,chẳng qua là vì,angry
001237,anh yêu em,neutral
005187,tôi chỉ coi cô là cái nồi cơm thôi,neutral
007539,ê,neutral
007306,thì lao vô tường nè,neutral
001138,"minh minh , anh xin em mà , đừng khóc nữa , anh xin lỗi",sad
007162,"tôi nói với cô là đừng có đi đừng có đi , cô sẽ bị tổn thương đó cô biết không , đừng đi",angry
007044,con biết là như vậy,neutral
001227,sao thích trả treo vậy,angry
005721,tui không ngủ đâu mà lo,neutral
007154,chắc chắn,neutral
005644,theo lịch em học môn gì vậy thầy,happy
005831,và sẽ cho tiền,neutral
002651,anh không tin,neutral
003788,để tôi đem chuyện ly dị ra đùa giỡn như vậy hả,angry
006090,ừ ha,happy
007333,cô nói cái gì,angry
003886,à em muốn mua sách hả cứ lựa tự nhiên đi ở đây bán rẻ lắm,neutral
004576,thì cũng có phụ nữ biến thái vậy,neutral
005946,cô thấy hoàn cảnh của tôi rồi đó,neutral
000377,chụp hình mặc đồ là sao,angry
001185,coi như huề,neutral
001099,minh minh,neutral
007401,đủ rồi Trúc đi rồi buông ra đi,angry
004247,khó chịu quá sắp bể bong bóng rồi mở cửa liền đi,angry
004746,hơi ê ê,neutral
000852,cho dù là,angry
002824,mặt quạu,angry
001300,ở với tôi suốt đời hay sao vậy,surprise
007827,vậy thì chúc hai người trăm năm hạnh phúc,angry
008275,nếu cảnh hôn không đạt coi như bộ phim thất bại,neutral
004010,phải thử mới biết,neutral
007671,tấm này có hở đâu mà phải xóa,neutral
001380,rồi bây giờ lên xe tôi chở đi,neutral
000589,cô làm vậy là đúng đó,neutral
005340,ai mà quỵt,angry
002749,thôi chào trúc,neutral
000518,"tất nhiên là không rồi , em đâu phải hết thời đến nỗi , kịch bản của ai cũng nhận đại mà đóng đâu",angry
001614,nếu như không có trúc á,neutral
005738,có trong hợp đồng sao,angry
000541,và la tôi um sùm còn gì,neutral
007263,nhưng mà nhớ nằm gọn lại nha,neutral
007756,thôi,neutral
008122,con gái chơi có kỳ không,neutral
003284,mẹ,neutral
007662,ừ thì là nhân viên,neutral
006557,anh vô nhà đi,neutral
004873,sao vậy,surprise
004612,ủa anh cũng thấy vậy sao,neutral
001262,trúc thật kỳ lạ và khó hiểu quá à,neutral
002142,"bộ cô nghĩ , tôi là người tốt bụng , dễ thương đáng yêu , nên cô muốn ở lại giúp tôi à",neutral
007290,nhớ lau dọn phòng cho tôi đó,neutral
002544,hai đứa vừa nãy chứ gì,neutral
000212,"mi tu á có nghĩa là , tôi cũng vậy , tức là , em cũng vậy , và có nghĩa là , cô ấy cũng phải về nhà vào lúc mười một giờ",happy
000776,ừ,angry
002996,họ thương tôi lo lắng cho tôi mà đẩy tôi ra đường như vậy hay sao,angry
007510,chứ có ai vừa được nhận vô là được trả tiền liền đâu,neutral
001067,dạ gần hai triệu,neutral
003712,không tôi không hiểu,neutral
007992,không biết chút xíu chụp hình lên có thấy không nữa,neutral
005596,tôi không hề đụng vô một giọt bia rượu nào hết trơn á,neutral
007218,rồi đi,neutral
006856,hy vọng đây là lần cuối cùng tôi với cô gặp nhau,neutral
006468,"anh ấy, sẽ bảo vệ cô không",neutral
007254,cái gì vậy,neutral
007279,mày chết đi,angry
002381,tôi xin hàng,neutral
004931,treo phòng cô đi,angry
003704,alo em nghe thầy sao rồi,neutral
000561,tôi cá cô bán sách cả đời cũng không kiếm được số tiền đó đâu,happy
005138,tôi không theo phá cô nữa,neutral
007647,ba ba đừng có nói vậy,sad
000536,con hiểu ba con mà,sad
001792,"tại sao lớn tiếng như vậy chứ , làm anh giật cả mình",neutral
002767,có phải đã lo xong không,angry
002611,"thôi, ờ đi ăn đồ tàu đi",neutral
001037,bà nội la cô hả,neutral
007754,con hứa sẽ cố gắng ạ,neutral
002934,cái tô tự dưng nó nhảy ra khỏi tay tôi chứ bộ,neutral
006223,cô tính toán gì vậy,neutral
007695,nè,neutral
005707,chẳng lẽ tôi phải nghỉ,neutral
004782,tôi đâu có dám nghĩ là trúc xấu đâu,neutral
005582,tôi sẽ tha lỗi cho Trúc,neutral
007645,cám ơn anh,neutral
008238,"Minh Minh, mau ra đây",angry
006068,con thỏ con thỏ con thỏ,happy
002143,thế là bằng tay chạy đi lấy cho ông ngay,neutral
001472,năm mươi ngàn á là giữ điều kiện không đọc nội dung,neutral
001415,phải về nhà nằm một cái cho đã,neutral
005747,bây giờ muốn gì nói đi,angry
005078,tại sao,happy
000048,là người ta biết chắc thầy thi giùm cho em,neutral
003144,nói,neutral
000034,được rồi,neutral
004867,lạ thiệt,neutral
000703,trúc ơi,happy
004796,đừng có xía vào chuyện của tôi,angry
004763,cô vừa phải thôi nha,angry
000925,hai chữ bảo nam to đùng sao cô không nhìn thấy được,angry
005177,dạ em biết,neutral
003773,thử thách đối với nghề đạo diễn của tôi,neutral
007147,có chuyện gì vậy,neutral
006262,đánh răng đi,neutral
005667,ế chồng là cái chắc,happy
004032,tôi thề luôn,neutral
000891,nghiêm túc á,angry
004985,nó mà ra tay,neutral
007046,con không có đi đâu hết á,neutral
004124,anh ghét tôi đúng không,surprise
008182,có ai ngồi đấy chưa,neutral
004434,mua tám ngàn một kí,neutral
005813,còn mà đặt giận hờn làm gì nữa,angry
005611,chắc chắn xảy ra nhiều bất tiện,neutral
000451,nhưng từ nãy giờ mình đi mấy tiệm đâu có tiệm nào trả cao hơn đâu,neutral
001999,mẹ thấy cũng đang học bài à,neutral
002675,tại lần trước ở nhà,neutral
001524,"là sao , thế tại sao tôi phải có trách nhiệm trong chuyện tụi nó đốt sách của cô , nếu tôi không muốn cho cô số điện thoại hoặc địa chỉ nhà của tụi thì cô nghĩ sao",angry
007956,không,angry
003399,cô khùng quá,angry
004096,mẹ con bị ngất xỉu,sad
000024,ừm vậy he,happy
005040,cầm đi,neutral
007919,tôi thi đại học hả,neutral
002191,mẹ,neutral
007102,"tôi sẽ nấu nướng , thiệt , kể cả chuyện giặt đồ dọn dẹp nhà cửa tôi cũng làm luôn",angry
007193,mấy chữ này á,neutral
008227,công nhận,neutral
001616,dạ con cảm ơn ba,neutral
007561,có chuyện gì vậy,neutral
008137,có cái gì mà khác nhau chứ,angry
005295,đi,neutral
004306,à quên,neutral
004727,nhưng tôi cho tăng thanh hà mất rồi,neutral
000349,trúc thật dũng cảm,happy
008326,sao biết tui ở đây mà tìm,neutral
002174,vậy thì ngậm miệng lại đừng nói gì nữa vô nhà đi,angry
002739,bởi vì ba tôi nói rằng,neutral
007079,tôi ghét cô,neutral
001089,làm vậy là với mục đích khác,neutral
000985,mẹ cứ làm như con không yêu ba mẹ không bằng,neutral
006706,nhanh lên kiếm lẹ đi,angry
007360,con đâu có đi đâu đâu,neutral
004579,còn xin tiền cho ngày mai,neutral
000306,bệnh của bảo yến sao hả ba,neutral
003039,ủa,happy
003267,"và lúc nào , tôi cũng muốn chăm sóc cho cô ấy",neutral
001955,còn lần này,neutral
004077,mà chở sách rồi sao chở tôi,neutral
008335,nhưng mà tôi chưa có sẵn tiền ở đây một hai ngày nữa đi,sad
007958,xong,neutral
001575,được,neutral
006207,trong đó ghi lý lịch,neutral
004063,tụi nó cứ tới quậy tụi mình hoài luôn,angry
002814,không lẽ trong suốt hai mươi hai năm qua,sad
000148,em nên đầu tư vào nghề học viết kịch bản chắc chắn em sẽ thành công,neutral
005359,tất cả đều phục vụ cho việc viết kịch bản và giúp khám phá khả năng diễn xuất của ngô đồng,neutral
006982,ừ trí nhớ vẫn còn tốt không vấn đề gì,angry
006849,sao chứ,neutral
001199,anh bắt đầu bằng việc chụp hình,neutral
004324,anh hỏi là em ăn sáng chưa đó,neutral
004684,anh có thể làm việc này việc nọ,neutral
005395,"tôi đâu có ngốc nghếch như cô , nói nhiều quá đi",angry
000005,"trời ơi có ai tấp vô cái chỗ của cô mà mua đâu , khi nào có người mua thì mình ngưng đọc , có tôi phụ bán sách cho , có gì đâu đọc đi",neutral
002166,cô đang giỡn với tôi đúng không,angry
002033,em vẫn thích đi chơi với anh ta chứ gì,angry
008003,bộ nhìn mặt anh em tưởng anh ngu lắm hả,angry
000530,con gái xinh hay là không xinh mới là quan trọng,neutral
002897,nên muốn đối xử tốt với cô mà,neutral
006234,ừ sẽ cố,happy
007108,coi như tôi với cô chưa từng gặp nhau,neutral
004140,tôi biết rồi,neutral
001340,sau mười phút nữa,neutral
002503,tôi ẵm cô vô trong kia ngủ,angry
004399,dạ,neutral
006518,ghét của nào trời trao của đó hả,angry
004260,à không,neutral
004546,anh phải tới trước ba anh,neutral
001382,kì cái gì mà kì,neutral
000302,cô nghĩ sao nếu tôi đưa cô mười triệu,neutral
001949,nó xảy ra vô cùng bất ngờ và khủng khiếp quá,sad
004784,mười giờ đi ba,neutral
002369,cô nói cái gì,surprise
002626,vậy vậy em định đi học khoảng bao lâu,sad
001758,ăn cho nhiều vô,neutral
000831,thật ra mọi chuyện đơn giản lắm chứ không như cô nghĩ đâu,happy
000296,vậy tôi kêu cô bằng gì,neutral
006741,thì tại sao hai người lại không kết hôn đi,neutral
006649,có lẽ ở sài gòn tôi là người bán sách tướng sang nhất ha,neutral
005196,cô giống khùng quá à,neutral
001029,hôm nay sinh nhật anh đình phong hả,surprise
002787,nên kiếm cớ nhốt tui ở ngoài đúng không,neutral
005123,và đừng làm gì dại dột,neutral
008208,"còn cô là con rùa , là con gà",neutral
002668,chỉ có cô là không cần tiền của tôi,neutral
002617,tin sao được mà tin,angry
004777,sao bắt tôi làm hết vậy,angry
006985,đừng để tôi nhìn thấy lần nữa,angry
007960,thầy đi trước đi,neutral
002299,nếu mà trúc đuổi tôi đi,sad
007820,cái gì,neutral
004029,và cơn ác mộng này bao giờ mới chấm dứt,angry
001727,trúc quả là thiên tài nó đâu trúng đó hay thiệt,neutral
001518,"nhưng mà , anh đã đánh nhau với nó , để lấy lại cục gôm cho em",neutral
007410,con mới nói với mẹ một câu ngắn có chút xíu,neutral
002864,nè dừng lại ngay,angry
006958,mà lát nữa cô ăn gì tôi mua cho,neutral
005436,là cái thá gì còn không bằng hai cái quần jean của tôi,angry
005568,"được thôi , nói được làm được nha",angry
006255,anh đã phát hiện ra,neutral
002225,"nhìn cái gì mà nhìn , nhìn cũng có giải quyết được vấn đề gì đâu",angry
003679,tất cả những thứ này,neutral
006460,"không đọc , tại sao phải đọc chứ , kịch bản của em viết , làm sao mà hay được , chắc chắn là dở rồi",angry
004902,rồi làm gì nữa,neutral
001260,đã nói là không cần phải tới thăm nội mà,angry
001566,đình phong tính sẽ trở về việt nam để làm ăn,neutral
002931,chứ nếu mà tôi biết viết á,neutral
004819,lương tâm đỡ cắn rứt đây mà,neutral
002779,rồi bỗng dưng,neutral
006167,ngủ ngon nha,happy
006986,là điều bí mật mà tôi chẳng thể nào nói hết,neutral
004906,cô đi đâu vậy,neutral
005647,"cô không thấy sao , tôi đang lau nhà mà",neutral
005894,công nhận hôm nay trời nóng quá,angry
006026,"mở cửa ra , tôi cần nói chuyện với cô chút xíu",angry
004686,muốn gọi tôi là cái gì cũng được hết á,angry
001241,à,surprise
002616,coi chừng bệnh lại á thì khổ tôi,neutral
003416,ừ,angry
002532,thôi tôi đi nha,neutral
007114,à năm mươi ngàn đi ha,neutral
002569,ủa,surprise
007981,sao ba lại nói vậy,neutral
003344,khi đã hiểu nhau rồi thì mới làm việc tốt được đúng không,neutral
004471,thế nào cũng xuống đây xin lỗi về chuyện chụp hình cho mà xem,neutral
004928,chứ cô trả tôi ba trăm ngàn một tháng làm sao tôi sống,neutral
002389,nhưng mà lỡ tui nói một hồi tôi nói không nghe,neutral
000074,ê xích qua chứ nằm vậy sao tôi nằm,neutral
000436,"minh minh , không lẽ lúc nào cô cũng chuẩn bị tâm lý cho mọi chuyện hay sao , kể cả chuyện ly dị tôi à",sad
005703,à,neutral
000143,ủa,neutral
001857,tại sao cô chưa rửa chén từ tối qua,angry
