id,transcript,emotion
008256,"chiếc xe đạp cột sườn ngang , té một cái là bó tay luôn á . mà Trúc thấy hông , may mà tôi thông minh tập nhanh á , chứ nếu không mặt tôi dán đầy băng keo rồi còn gì",happy
003246,cô nói vậy là sao,surprise
005948,rồi chia bài đi,neutral
003161,nhưng mà em vẫn cứ lo,neutral
006589,trời,neutral
005648,bởi vì tôi đã gặp được và cưới được một người phụ nữ rất tuyệt vời,happy
007490,tui nói thật đó,neutral
007615,mười ngàn được rồi,neutral
000400,nó mà kéo tới nhà méc ba mẹ anh lần nữa,neutral
006906,ủa mà lúc nãy tôi tìm hoài trong nhà không thấy có công tắc điện nào hết trơn á,neutral
004013,em nhớ rồi,neutral
007706,trời,neutral
006638,sao cái nhà này cái gì cũng không vậy trời,neutral
001681,lạ quá sao mà giống nhau như hai chị em sinh đôi vậy,neutral
005404,có thể lắm,neutral
001703,tôi đâu có điên,angry
000954,không được,angry
005640,đây là tờ hợp đồng cũ,angry
007538,thầy biết rằng em trả tiền cho thầy nhưng có học hành gì đâu,angry
007799,tôi đã suy nghĩ kỹ lắm rồi,neutral
003172,ý anh là sao,neutral
006291,tại tôi bây giờ cũng đâu biết ba mẹ mình mang họ gì đâu,neutral
007450,trời ơi đá tôi suýt chết luôn á,neutral
002210,đi theo tôi,angry
001331,hôm nay không bán,neutral
007393,thì nó huề tụi mình luôn,neutral
004631,cô phải gặp ba mẹ tôi,neutral
002634,anh ơi,neutral
003579,điên thật,angry
004163,cô học nấu ăn vài năm nữa đi,neutral
000127,trời ơi,angry
004959,tôi chưa thấy ai gàn dở hâm như cô luôn á,neutral
004970,còn con,angry
005673,ti vi không,neutral
000714,điều kiện gì,neutral
005587,"chắc là lại hăm chém hăm giết tôi thôi , chứ có gì đâu",neutral
004264,ai da,surprise
001523,à mà trúc,neutral
001689,nhớ làm đồ ăn mang theo đó,neutral
006999,tối ngày nghĩ ra chuyện gì đâu không à,angry
007831,nói vụ nhà vệ sinh mới nhớ,neutral
002489,và rồi ba mẹ tôi cũng xuất hiện,happy
000220,anh ta muốn gặp cô thường xuyên đúng không,angry
001623,để anh với em có thời gian hiểu nhau và làm quen với nhau,neutral
005622,à tác giả,neutral
002062,e ờ nãy giờ tôi đọc đến đâu rồi ha,happy
005824,con đi du lịch Thái Lan,neutral
000332,tôi sẽ không theo phá cô nữa,neutral
003811,anh thề,neutral
001296,con không phải là con của ba mẹ,angry
007341,chứ còn bây giờ tụi nó phát hiện ra mình bị đuổi ra khỏi nhà hết tiền,neutral
001638,giống lắm luôn á,neutral
000155,vậy tụi mày nói đi,angry
001698,nhiều mà vẫn đồng ý giúp tôi,neutral
003327,nghiêm túc,neutral
002424,làm gì có chuyện đó,neutral
003818,"lần trước đó , mỗi lần cô giận tôi",neutral
004139,rồi còn hàng loạt những thứ linh tinh khác nữa,neutral
004858,nó hại mình quá trời luôn,sad
004682,sao mà cô dai như con đĩa vậy,angry
000850,nhà cửa lúc nào cũng phải sạch sẽ gọn gàng,angry
004504,hy vọng là sẽ ngon,happy
006481,từ giờ trở đi anh với con nhỏ đó cũng không gặp nhau nữa đâu,angry
001499,mà sao tự dưng cô tới nhà ba mẹ tôi,angry
007334,xem phim xong tôi chở đi ăn rồi chở về nhà luôn,happy
008328,"tôi không phải là người tốt , tôi rất ích kỷ và xấu xa cô nghe rõ chưa",angry
005546,cái bản kế hoạch chẳng ra gì đó hả,angry
003887,cô lau đi,neutral
000917,nhớ nha,happy
007905,óc chim óc gà đó,angry
004823,thậm chí cô có thể đi gặp đình phong bất cứ khi nào cô thích,angry
007338,ờ mở cửa giùm tôi nhanh lên đi,angry
004977,mà chờ sẵn vậy,neutral
007336,cô gật đầu thì có sao đâu,neutral
004323,cám ơn nha,happy
004329,thôi không đi mua nữa đi về nhà đi,neutral
002344,có anh hiều trong đó rồi mà,neutral
004341,"không phải quan trọng là hiểu họ được bao nhiêu , mà cô đang chứng tỏ cô là một con bò cái",neutral
006055,vừa nãy không phải chính cô năn nỉ xin tôi chữ ký hay sao vậy,neutral
000428,tôi gọi như vậy không đúng sao,neutral
003255,tụi mày nghĩ tao không biết cách trả thù hay sao,happy
000062,trời ơi,neutral
008266,rồi chơi lại,neutral
005763,vì Bảo Yến đó,neutral
007665,càng tốt,neutral
006313,ai làm vậy dã man quá,neutral
005191,"bởi vì , ít lâu nữa , thì báo chí sẽ đăng tin vụ ly dị giữa tôi với cô",neutral
005601,nhớ chuyện thằng Nghĩa hôm qua,neutral
007817,không ngon hả đừng ăn,angry
004965,kế tiếp là ba,neutral
001675,cô có biết không hả,neutral
007400,"với lại , căn phòng cũng bỏ trống , nên anh vô ngủ thôi",neutral
006824,ba anh đã nói vậy là căng lắm á,neutral
005668,tốn tiền điện lắm đó,angry
000935,"được thôi , không thích thì đừng làm",neutral
008236,mà từ đề cương đến khi kịch bản hoàn thành thì khác xa nhau lắm,neutral
006079,chỉ là cảm giác hụt hẫng xen lẫn tức giận thôi,neutral
000771,dạ chắc được chứ chị,happy
007302,còn Trúc chưa đi khỏi ông xách dao rượt chém tôi thì sao,neutral
006646,tất cả là của Trúc,neutral
000335,tôi muốn các bạn tưởng tượng điều này,neutral
001785,mơ gì đâu mà y chang như thiệt vậy đó,angry
003123,sáng giờ trúc bán được nhiêu rồi,neutral
008251,và tôi cũng đã hứa,neutral
006841,"ủa , chương trình gì vậy",surprise
001429,cái gì,angry
000058,với lại ở đó có nhiều gió lắm,neutral
008287,tôi đi lang thang cả đêm,sad
004148,tôi học qua ngành y rồi,neutral
000374,cô tưởng cô trốn mãi trong đó được hả,angry
007424,yên tâm,neutral
008190,dạ cám ơn chị,neutral
001874,ờ cũng thường,neutral
001595,tối qua tôi nằm suy nghĩ tôi mới giật mình từ ngày quen trúc tới giờ tôi đã mang lại cho trúc rất nhiều rắc rối,neutral
001779,không muốn đi chơi hả,neutral
000314,"hôm qua tôi có công chuyện , nên mới không tới thôi",angry
002670,mẹ xuống trước đi,neutral
004377,rồi tôi cất đây,neutral
003899,ừ,neutral
000590,tôi phải luôn luôn cách xa cô ít nhất mười mét,angry
005337,tôi sẽ bán sách với một điều kiện,neutral
004231,phòng trúc vậy,sad
004330,lâu lắm mới uống bia,neutral
000493,chắc chuyện cuộc đời tôi cũng viết thành một bộ phim truyền hình dài tập á,neutral
001407,"tôi thấy rất kỳ lạ , ý tôi là , đó là cảm xúc rất mới mẻ",neutral
000064,nói cái gì,angry
001480,không có đâu nha,neutral
004108,"nhường à , đừng hòng",angry
000107,ừ cái thằng ăn trộm sách khốn khiếp,angry
005363,không muốn ăn,angry
004475,bị nghi là đúng lắm mà,neutral
007993,thấy chưa tôi nói đâu có sai đâu,angry
007882,sao uýnh bi da có một mình vậy,neutral
005724,căn nhà đâu chỉ là căn nhà thôi,neutral
001748,mà sau khi giao sách xong,neutral
008277,tiền điện mắc lắm đó,neutral
007366,tôi bắt cô đi ra ngoài trời giữa trời mưa,neutral
007533,cô cho tôi mượn một triệu rưỡi để trả tiền phòng khách sạn,neutral
002587,trời ơi mười lăm phút nữa chắc hai chân tôi gãy luôn quá,angry
002717,anh không tin bất cứ lời nào em nói nữa không tin không nghe,angry
008210,thằng cha này hay canh me lúc Trúc đi vắng là tập kích,angry
001195,thật ra tôi cũng thấy hơi đau,neutral
007559,giờ tôi mới biết á chạy xe đạp nguy hiểm xe mô tô nhiều,neutral
006783,và tôi nghĩ rằng bây giờ là lúc thích hợp nhất để tôi hỏi,neutral
006465,chơi tiếp đi,happy
002911,tôi có nói địa chỉ tới không,angry
004992,có cái băng ghi âm mà đem ra hù hoài,neutral
003200,"em thông cảm nha , để khi khác",neutral
000702,cô phải quen chứ,happy
005098,nhưng không thể được,sad
005819,có cần tôi trả tiền lương cao hơn cho cô không,neutral
007600,cô có đau lắm không,neutral
006347,tất cả đã sẵn sàng xong xuôi,neutral
007133,"để xem sau này , tôi có mua cho cô cái gì nữa không , không bao giờ nha",angry
001709,thôi,neutral
000509,vậy không bán nữa hả,angry
006830,thì còn ai vào đây nữa,neutral
007771,"thì hôm nay tới xem , coi có con thú nào mới không thôi",angry
001109,ừ,happy
006397,không phải là không có khả năng xảy ra đúng không,angry
006471,tôi không có xỉn cô nghe rõ chưa,angry
007790,dạ,neutral
007327,"tôi không đầu tư vào tiệm vi đi ô của mấy người đâu , mấy người thích làm gì thì tự bỏ tiền ra mà làm",angry
003466,vậy tôi về nhà trước nha,neutral
008255,Trúc quả thật là tài năng,neutral
000699,dạ không,neutral
008024,mà lúc đó phản công chưa muộn đâu,neutral
003969,chào anh,neutral
007506,"một câu chuyện thú vị và lạ lùng , hai vai chính cũng hay nữa , vai em quá hay luôn , tối nay về Sài Gòn anh sẽ viết liền em thích không",happy
007269,cô có muốn tới đó nghỉ ngơi không,neutral
005655,đúng là đầu óc cô có vấn đề thật rồi,happy
004717,"thích chứ , cô ấy đóng gọi giấc mơ về và giải cứu thần chết rất là hay",happy
007369,tui muốn biết tui thiếu nợ cô bao nhiêu,neutral
005967,ủa mà sao không nghe Trúc nói gì hết vậy,angry
004439,điều kiện gì cô nói đi,angry
005145,ở đây được chưa,neutral
002652,ủi cả ra gối,neutral
000997,hay là tôi đi chung với trúc,neutral
002467,công nhận cô thông minh thiệt á,happy
000558,chết lúc nào,angry
003833,biết rồi biết rồi,angry
000462,cô nói gì vậy,angry
007385,nãy giờ cái mặt anh sượng ngắt chứ đâu có cười cười nói nói,neutral
001163,tôi ôm chân trúc ngủ,angry
007929,ngô đồng phải tin tưởng và nghe lời tôi tuyệt đối,neutral
003446,cô đi mà méc ngay đi,neutral
004719,đêm qua tôi nằm suy nghĩ mãi tôi thấy trường hợp của ngô đồng rất là thú vị,neutral
007543,tôi sẽ đãi Trúc bằng tiền lương của tui nha,neutral
004696,không thể như vậy được,angry
008321,đàn ông gì mà chửi dẻo hơn đàn bà luôn,neutral
005621,tới quảng cáo vô cũng chưa muộn mà,neutral
001041,giờ này ai mà thế chỗ,neutral
008146,chờ đó tôi về liền,neutral
006774,ở chung với chó có ngày bị rận cắn là như thế nào trời ơi,neutral
005807,đó hôm qua tôi cầm một trăm ngàn mà tôi xài cực kỳ tiết kiệm luôn còn dư bảy ngàn nè,happy
000492,ủa mà sao lâu rồi không thấy a,happy
002866,cầu trời đừng cho ai quen thấy mình lúc này,neutral
007781,hôi quá,neutral
000675,tôi đúng cô sai,angry
002735,"cái gì , phòng của tôi hả",angry
002056,cô thì giúp được gì cho tôi,angry
005022,lúc ở trong bệnh viện con cũng muốn gọi về cho ba mẹ,neutral
006276,em sẽ đưa cô ấy về,neutral
002393,anh ta giàu lắm,neutral
002337,xạo đâu mà xạo,neutral
003683,làm cho cô đợi hả,neutral
002306,"anh cũng không quan tâm , bởi vì anh biết chắc là , nó chẳng có gì hay ho cả",angry
000033,ừ không phải gởi trúc gởi tôi nè,neutral
004952,ờ dù cùng là một loại nước hoa nhưng mà với những làn da khác nhau thì lại cho ra những mùi khác nhau một chút xíu,neutral
003559,à là ý con á,neutral
006551,đừng có đụng vào tao,angry
002847,mẹ cố gắng giải thích cho ba với nội hiểu giùm con với,neutral
001433,cô bị điên rồi tại sao bịa đặt vậy hả,angry
003011,chín mươi hai triệu,neutral
001234,hai từ đó gắn với tôi,neutral
007908,sao Trúc không để sáng mai rồi giặt,neutral
001468,trúc trúc,neutral
001923,thì cũng phải từ từ tôi mới bỏ được chứ,neutral
005983,vậy thì chắc chắn là ba tôi hoặc mẹ tôi,neutral
002326,ủa,surprise
003382,bực mình ghê ý,angry
001877,chứ anh trả có năm ngàn ba cuốn,neutral
000795,"chuyển từ người xấu sang người tốt , sao gọi là trở mặt được , phải nói là thay đổi chứ",happy
008155,tụi bay tới đây làm gì,angry
000976,ờ không gia đình tập hai,happy
005852,thôi không được đâu,angry
003736,"nhưng cô nghĩ cô là ai , tại sao cô lại muốn ở lại bên cạnh tôi",angry
000829,ngon đập đi,angry
001894,còn gì nữa,neutral
005448,nghề gì vậy,neutral
000259,cô vừa nói,neutral
000663,tôi không biết rằng tôi làm cho cô khổ rất nhiều,sad
007301,ngay từ đầu tôi đã muốn như vậy rồi,angry
006863,chắc là rơi chỗ khác rồi,neutral
005420,cô biết cái gì mà nói,angry
003084,đưa đi,angry
002257,chào chị,neutral
007146,thì tại lúc đó đơn giản chỉ là bạn bè chia sẻ với nhau mọi chuyện thôi mà,neutral
001287,mà trúc đi đâu vậy,neutral
000602,ngày gì vậy ta,surprise
006802,"tôi biết mà, cô thì làm sao mà học được chứ",neutral
007944,"sao lại ngủ ở đó , đi vô giường cô ngủ đi",neutral
001478,xe của mình ở đâu ta chỉ còn cái xe của ba,angry
002702,tới có chuyện gì không,angry
005347,cô nói đi,neutral
004886,hài quá hả,surprise
002095,bởi vì trúc muốn giúp tôi cái việc làm thôi,neutral
007145,Tôi đã gọi điện thoại mời anh Đình Phong trưa nay tới nhà mình ăn cơm rồi á,neutral
000553,một kết thúc có hậu và đẹp như trong phim,happy
003476,tôi chưa bao giờ xỉn mà sáng dậy không nhớ gì hết á,neutral
001427,"cô chạy đi , cô chạy không thoát khỏi tôi đâu",angry
001644,khủng khiếp thật,neutral
006717,"Minh Minh, hình như cô quá ngốc nghếch, nên cô không hiểu",neutral
004588,thằng nhiều chuyện,angry
004869,sau khi tôi nấu xong thì cho cháo vào cà mên rồi mang đến cho bảo yến,neutral
005872,em cám ơn anh ủa mà anh,happy
002171,anh có phải cỏ cứu bấm mặt tím đâu,neutral
004570,trời ơi bây giờ bê hết đống đồ ra vứt ngoài sân á hả,surprise
007264,có chuyện gì hả,neutral
003796,thấy thằng khác ngưỡng mộ mình chỉ có con bồ đẹp,neutral
000895,"ký liền đi , hơn bốn trăm tấm đó , mà ký xong á còn phải làm tất cả các công việc nhà rồi mới đi chơi đó",happy
003177,trời sắp mưa rồi,neutral
007117,tính lừa mình à,angry
005446,cô về rồi hả,neutral
007239,cái gì,surprise
004744,sao kỳ vậy,surprise
000758,kỳ lạ thiệt,neutral
000508,căn phòng á,neutral
007222,tụi mày tin rồi đó,neutral
007388,Minh Minh đang hợp tác viết kịch bản với anh ta mà,neutral
000271,thầy thí điểm vừa vừa thôi,neutral
006115,"nội hả , dạ vâng con nghe đây",happy
006100,nói nhiều quá chung tiền đi,angry
000017,"anh biết rồi , bai em nha",neutral
007982,đồ ăn sáng xong chưa vậy,neutral
000135,"khi nào à , hồi nãy nè",angry
001879,nhờ anh hiều bán giùm,neutral
006001,tôi đâu có chụp cô,neutral
005003,minh minh à,neutral
006111,tôi không theo phá cô nữa,angry
007135,"tôi sẽ nói cho cô biết về cá tính của từng người một trong gia đình tôi , trước tiên là mẹ , mẹ hiền lắm nhưng mà một khi mẹ nổi giận lên thì cũng đáng sợ lắm",neutral
005541,chị có hẹn ra quán cà phê đâu,neutral
007008,mỗi khi đi đâu mẹ mang tôi đi,neutral
005945,tiền taxi còn không có tiền trả nữa là,neutral
000236,có giống mặt một thằng chuyên nghiệp,neutral
006590,thầy đang giữ cũng ban thỏa thuận với em với thầy mà,neutral
004731,là tiền cho thêm tài xế taxi đó,neutral
001304,tôi để đâu cũng không nhớ nữa,neutral
005856,giúp như thế nào,neutral
005660,không biết đi đâu mà để xe ở nhà vậy trời,sad
001712,chắc chắn là vậy rồi,neutral
005147,ba nghe cũng giải thích đã,sad
005143,để tụi mày đừng đụng đến tụi tao nữa hả,angry
001249,bốn chữ nói thẳng ra còn chẳng hết ý nữa là ám chỉ,neutral
000881,anh mắc cười quá,angry
004939,"cô ăn một mình đi , tôi đi nha",neutral
007786,trời vẫn còn nắng mà,neutral
001220,vậy là cô với anh phong yêu nhau lâu rồi phải không,neutral
006936,tôi đã xin lỗi rồi mà,angry
001646,mà mới có ngủ được có một hai phút à,neutral
003139,bộ lúc soạn thảo cái hợp đồng này,neutral
003351,nhưng mà sáng mai con dậy con sợ con quên,neutral
002377,dạ con không biết,neutral
005121,chứ để ba mẹ hiểu lầm con,sad
008299,cô có nhiều chuyện là sao,neutral
000609,sẵn sàng đạp tôi ra khỏi cửa,neutral
006935,trời ơi,neutral
008083,nhà này có nhiều kỷ niệm lắm,neutral
001329,sáng nay người ta vô bệnh viện làm từ thiện cho tôi một trăm ngàn còn dư năm hai ngàn đó,neutral
002205,để yên cho tôi ngủ,neutral
003179,chỉ vì nghĩ tôi là con ruột của họ thôi chứ nếu không phải họ chỉ muốn tôi chết đi,angry
006348,mặc bộ đó hả người ta tưởng tôi khùng hơn,angry
006728,anh thấy thật vui thật thú vị và có ích,happy
004614,sẽ phải hối hận đó,neutral
005310,bình tĩnh cái con khỉ,angry
007589,nhà kho là chắc nhiều chuột với gián lắm đây,neutral
005881,và bất kỳ phụ nữ nào yêu anh ta xong,neutral
003668,con nằm dưới ghế sofa,neutral
007513,cô hứa rồi đó nha,happy
004848,giờ heo xinh xinh heo men ly đi trên con đường,happy
001413,ý tôi hỏi là chở tới chỗ nào,neutral
005287,và nói giúp tôi một câu thôi,neutral
005850,dạ có gì không ba,neutral
001125,tôi thấy kỳ cục lắm,neutral
000004,hát nữa hả,happy
005210,tôi cũng ghét cô lắm đó,angry
007352,à thì chụp xong là tiến hành học diễn xuất luôn,neutral
000423,"chị nói là phòng này rẻ nhất chung cư , vậy mấy phòng khác to đẹp hơn hả chị",neutral
002233,anh đang ở nhà,neutral
007256,lần đầu tiên tôi mới nghe nói á,neutral
005679,của chị là sáu kí bảy tất cả à tụi em mua,neutral
003256,vô đại luôn đi,neutral
006218,hai chai vị chi là hai mươi sáu ngàn,neutral
003786,tám trăm sáu chục ngàn,neutral
003593,mà sao từ sáng tới giờ trúc không vô bệnh viện vậy,neutral
004735,tôi tặng cô chiếc xe đó,neutral
005500,tôi cũng nghĩ vậy á,neutral
002876,cô làm vậy là giết chết tôi á,angry
003681,dù sao ở đây cũng xảy ra chuyện rồi,neutral
005603,tìm lẹ đi tôi chảy máu tôi chết mất,angry
003067,biết đâu cả hai người đều nghĩ mình đi tự tử,neutral
003930,"hạng người như cô , tôi không bao giờ thèm để mắt tới đâu",neutral
006112,để anh suy nghĩ đã,neutral
004480,trời ơi,angry
004531,đưa tôi chỉ cho,neutral
001081,tôi đang viết kịch bản phim,neutral
002821,khăn trải bàn khăn tay,neutral
002248,cô bị khùng hả,angry
001334,"mặc kệ em tự loay hoay với khả năng diễn xuất dở hơi của em , anh thách em dám giữ luôn máy ảnh và máy tính của anh đó",angry
001711,cái giường nó êm và rộng lắm,happy
008180,anh lại dừng xe lại một chút,neutral
003884,ở đây,neutral
004771,qua kia ngủ đi,neutral
002153,trưa nay cố gắng nấu ăn thật ngon nha,neutral
003439,sao diệp khánh duy đã đến chỗ này,surprise
005193,nhìn cái gì,neutral
004937,nếu tôi tìm được việc khác,neutral
002994,hết chuyện,neutral
000910,dạ,neutral
000099,sao đang nói chuyện cô bỏ đi đâu vậy,angry
000516,ý chị nói là phòng này có ma hả,surprise
006175,tôi nói cái ý đối thủ là ý khác kìa,neutral
000688,nhưng mà chuyện tôi nói,angry
005860,"yêu một người , mà lại đau khổ như vậy , nhưng vẫn cứ yêu",sad
008344,cô nói gì chứ,angry
002280,cô lại còn dám nói chuyện tiền lương à,angry
003688,trúc nhìn tôi đi,neutral
001298,không hứa thì cũng đâu thể quên được,sad
001257,tụi con diệp thằng khánh sẽ thôi không tới quậy tôi và trúc nữa không,neutral
004359,cô thiệt ngốc nghếch,neutral
003134,chẳng ai tốt với tôi cả,neutral
002270,tôi buồn hay trúc buồn,neutral
002473,nhà cô ở đâu,neutral
001513,giơ tay lên không tao bắn,angry
004455,và sẽ trả lương cho cô,neutral
001501,tối hôm qua,neutral
007296,tôi sẽ phù hộ để đền ơn cô giúp tôi,neutral
005171,trời ơi hôm nay buồn ngủ quá trời thôi để bữa khác tập đi,sad
007725,tôi bồi thường cho cô á,neutral
004012,đó quá đơn giản quá dĩ dàng để lấy mười triệu đúng không,happy
005376,không hay ai nói,neutral
007765,thằng chó Nghĩa,angry
002586,chứ đừng có ngủ trên bàn,neutral
006748,cô làm tui nổi hết da gà,angry
001965,thì đó cái chiêu đá trúng chỗ hiểm á,neutral
002006,vậy còn sâu,neutral
002383,nhưng toàn là những bộ tôi thích nhất à,happy
006509,bàn tay ơi,happy
005799,nhớ chưa con rùa óc gà,neutral
003740,"tính tình của em đúng là lúc nào cũng bừa bãi lộn xộn , không có anh là mọi thứ linh tinh hết cả lên",angry
000174,phải thật nhanh để mọi người không kịp đối phó,happy
003819,trời vẫn mưa,sad
000129,hơi đỡ đỡ rồi,happy
004133,anh đây,neutral
006505,sáng nay con không nhớ gì hết,neutral
003508,bán quần áo có vẻ dễ,neutral
005069,quả là công tôi lớn thiệt ha,happy
003781,cái gì,surprise
006268,cô là món quà hả,angry
002052,chứ giờ tính sao,neutral
007344,có phải là tôi đối xử với cô quá tệ bạc không,neutral
000742,yên tâm tôi sẽ nhờ yến trở về,happy
007641,mà sao cô nghĩ đó là sự dối trá,neutral
005930,ở đâu vậy,neutral
000618,"một con người giống như cô , thì đúng là",neutral
004176,cô là người nói dối,angry
000826,à cũng hai lăm ngàn đó em,neutral
002260,xe này đi dễ lắm,neutral
006803,nhìn anh trông giống coi nhà giàu đúng không,happy
005916,ở đâu,angry
008223,nói chuyện,neutral
006773,làm sao cô biết chuyện đó,surprise
007390,tui tới đó làm gì,angry
002083,với hai trăm ngàn một ngày,neutral
004189,thì đâu có dám nói cái ý khác đâu đúng không,neutral
003955,còn nhỏ bán sách đáng ghét đó đã gây ra cho anh biết bao nhiêu là rắc rối,angry
005466,"vậy sao , xem ra anh quyết tâm quá ha",neutral
007530,chỉ thôi nhưng tôi chưa làm bao giờ,neutral
008022,chuyện này quan trọng mà,neutral
008078,tôi mà ở với anh,neutral
001224,chỉ mong sao có việc làm để không phải chết đói và không phải ngủ ngoài đường thôi,neutral
000834,làm sao mà xài một ngày với hai trăm ngàn được,sad
002777,cô muốn siết chặt tay tôi,angry
000716,lại hẹn ra công viên tôi thắc mắc,surprise
007813,hẹn gặp nhau ở rạp nha,neutral
004459,nhưng mà anh đình phong đánh nó một trận,neutral
000173,nãy có hai trăm ngàn ở đây mà giờ đâu rồi,neutral
001530,mà tôi chết,neutral
008313,"với thành công lần này , tôi cũng xin được gửi lời cảm ơn tới rất nhiều người đã giúp đỡ tôi , và đặc biệt , tôi gửi lời cảm ơn tới nồi cơm ở nhà , đã dạy cho tôi rất nhiều điều",happy
005687,"vụ bỗng dưng muốn khóc phần hai sao rồi , suy nghĩ tới đâu rồi , có quyết định tham gia hay không",neutral
006101,cô ấy bị kẹt xe mà,neutral
003915,căn nhà này á,neutral
001267,"không , tôi sẽ không gọi nữa đâu",neutral
003331,ủa cài bẫy luôn hả,neutral
003461,còn một điều nữa,angry
006267,nhưng mà tôi đi xe này rồi thì Trúc ra chỗ bán sách bằng gì,neutral
001741,thật ra cô ta là người như thế nào,happy
007042,trời ơi,neutral
000213,cái gì,surprise
006087,không phải là cô cũng muốn mời anh ta tới nhà ăn cơm hay sao,angry
007598,cô đã làm việc gì sai trái không hả,angry
006720,bực mình thằng cha Hiều này quá,angry
002396,chờ tôi hả,neutral
007878,tôi cúp máy nha,neutral
002967,mất chiếc xe mô tô của tôi được chưa,angry
004840,là lần sau không bao giờ tôi ngủ trong lúc bán hàng nữa đâu,neutral
003780,hai người đó đi xem phim chung với nhau hả,angry
000988,chưa đủ hay sao hả,angry
005153,"tôi thích nói vậy á , cô làm gì chứ",angry
002073,trúc nghĩ vậy sao,neutral
000354,tôi là người chứ đâu phải là bò đâu mà không biết suy nghĩ hả,neutral
